[
  {
    "num": 1,
    "name": "The Gates Scholarship",
    "organization": "The Gates Scholarship",
    "statusNote": "September 15, 2026",
    "id": "the-gates-scholarship",
    "type": "scholarship",
    "displayType": "Scholarship",
    "description": "A highly selective scholarship for outstanding high school seniors from low-income households who demonstrate academic achievement, leadership, and perseverance.",
    "stages": [
      "High School Sophomore",
      "High School Junior",
      "High School Senior"
    ],
    "interests": [
      "Education",
      "Career"
    ],
    "states": [],
    "requiredSignals": [],
    "preferredSignals": [
      "LOW_INCOME",
      "FIRST_GEN",
      "LIMITED_ACCESS",
      "EDUCATION",
      "BUSINESS"
    ],
    "excludedSignals": [],
    "sourceUrl": "https://www.thegatesscholarship.org/scholarship/",
    "sourceLabel": "Official source",
    "opensAt": "2026-07-15",
    "closesAt": "2026-09-15",
    "statusHint": "open",
    "active": true,
    "lastVerifiedAt": "2026-09-04",
    "featured": true,
    "award": "Last-dollar funding for the full cost of attendance not already covered by other financial aid and the Student Aid Index.",
    "requirements": [
      "High school senior",
      "Pell-eligible",
      "Minimum 3.3 weighted GPA",
      "Plan to enroll full-time in a four-year U.S. nonprofit college or university"
    ],
    "eligibilityNote": "U.S. citizen or permanent resident"
  },
  {
    "num": 2,
    "name": "Coca-Cola Scholars Program",
    "organization": "Coca-Cola Scholars Foundation",
    "statusNote": "September 30, 2026 at 5:00 p.m. ET",
    "id": "coca-cola-scholars-program",
    "type": "scholarship",
    "displayType": "Scholarship",
    "description": "An achievement-based scholarship recognizing high school seniors for leadership, service, and positive impact in their schools and communities.",
    "stages": [
      "High School Sophomore",
      "High School Junior",
      "High School Senior"
    ],
    "interests": [
      "Education",
      "Career"
    ],
    "states": [],
    "requiredSignals": [],
    "preferredSignals": [
      "EDUCATION",
      "BUSINESS"
    ],
    "excludedSignals": [],
    "sourceUrl": "https://www.coca-colascholarsfoundation.org/apply/",
    "sourceLabel": "Official source",
    "opensAt": "2026-08-03",
    "closesAt": "2026-09-30",
    "statusHint": "open",
    "active": true,
    "lastVerifiedAt": "2026-09-04",
    "featured": false,
    "award": "$20,000 scholarship; 150 Scholars are selected annually.",
    "requirements": [
      "Graduating during the 2026-2027 school year",
      "Minimum 3.0 GPA",
      "Plan to pursue a degree at an accredited U.S. postsecondary institution"
    ],
    "eligibilityNote": "Eligible U.S. citizenship or residency status required"
  },
  {
    "num": 3,
    "name": "QuestBridge National College Match",
    "organization": "QuestBridge",
    "statusNote": "October 1, 2026 at 11:59 p.m. PT",
    "id": "questbridge-national-college-match",
    "type": "college access",
    "displayType": "College Access + Scholarship",
    "description": "Connects high-achieving students from low-income backgrounds with admission and full scholarships at leading U.S. colleges.",
    "stages": [
      "High School Sophomore",
      "High School Junior",
      "High School Senior"
    ],
    "interests": [
      "Education",
      "Career"
    ],
    "states": [],
    "requiredSignals": [],
    "preferredSignals": [
      "LOW_INCOME",
      "FIRST_GEN",
      "LIMITED_ACCESS",
      "EDUCATION",
      "BUSINESS"
    ],
    "excludedSignals": [],
    "sourceUrl": "https://www.questbridge.org/apply-to-college/programs/national-college-match",
    "sourceLabel": "Official source",
    "opensAt": "2026-08-01",
    "closesAt": "2026-10-01",
    "statusHint": "open",
    "active": true,
    "lastVerifiedAt": "2026-09-04",
    "featured": true,
    "award": "Full four-year scholarships to QuestBridge college partners, covering tuition, housing, food, and other expenses with no parental contribution or student loans.",
    "requirements": [
      "High school senior",
      "Strong academic record",
      "Significant financial need; typical finalists come from households below about $65,000 for a family of four"
    ],
    "eligibilityNote": "Open to high school seniors attending school in the U.S.; U.S. citizens and permanent residents abroad may also apply"
  },
  {
    "num": 4,
    "name": "Greenhouse Scholars Whole Person College Program",
    "organization": "Greenhouse Scholars",
    "statusNote": "Part 1 deadline: November 16, 2026",
    "id": "greenhouse-scholars-whole-person-college-program",
    "type": "scholarship",
    "displayType": "Scholarship + Mentorship",
    "description": "A multi-year college success program for high-achieving students from low-income communities who demonstrate leadership and commitment to their communities.",
    "stages": [
      "High School Sophomore",
      "High School Junior",
      "High School Senior"
    ],
    "interests": [
      "Education",
      "Career"
    ],
    "states": [],
    "requiredSignals": [],
    "preferredSignals": [
      "LOW_INCOME",
      "FIRST_GEN",
      "LIMITED_ACCESS",
      "EDUCATION",
      "BUSINESS"
    ],
    "excludedSignals": [],
    "sourceUrl": "https://apply.greenhousescholars.com/",
    "sourceLabel": "Official source",
    "opensAt": "2026-09-01",
    "closesAt": "2026-11-16",
    "statusHint": "open",
    "active": true,
    "lastVerifiedAt": "2026-09-04",
    "featured": false,
    "award": "Up to $5,000 per year in last-dollar tuition support, plus potential flex funding, mentorship, networking, and internship support.",
    "requirements": [
      "High school senior entering a four-year college in fall 2027",
      "Household income at or below $80,000",
      "Minimum 3.5 unweighted GPA",
      "Must live or attend school in an eligible state/area"
    ],
    "eligibilityNote": "U.S. citizen or permanent resident"
  },
  {
    "num": 5,
    "name": "Daniels Scholarship Program",
    "organization": "Daniels Fund",
    "statusNote": "October 15, 2026 at 4:00 p.m. MT",
    "id": "daniels-scholarship-program",
    "type": "scholarship",
    "displayType": "Scholarship + College Support",
    "description": "Supports values-driven high school seniors with financial need, leadership potential, strong character, and a commitment to community service.",
    "stages": [
      "High School Sophomore",
      "High School Junior",
      "High School Senior"
    ],
    "interests": [
      "Education",
      "Career"
    ],
    "states": [],
    "requiredSignals": [],
    "preferredSignals": [
      "EDUCATION",
      "BUSINESS"
    ],
    "excludedSignals": [],
    "sourceUrl": "https://danielsfund.org/our-work/scholarships/",
    "sourceLabel": "Official source",
    "opensAt": "2026-09-01",
    "closesAt": "2026-10-15",
    "statusHint": "open",
    "active": true,
    "lastVerifiedAt": "2026-09-04",
    "featured": false,
    "award": "Up to a full cost-of-attendance scholarship at an accredited nonprofit U.S. college or university.",
    "requirements": [
      "High school senior in Colorado, New Mexico, Utah, or Wyoming",
      "2025 household AGI generally $100,000 or less, with adjustments for additional dependents",
      "Demonstrated leadership, service, and academic promise"
    ],
    "eligibilityNote": "See official eligibility requirements"
  },
  {
    "num": 6,
    "name": "Cooke College Scholarship Program",
    "organization": "Jack Kent Cooke Foundation",
    "statusNote": "November 11, 2026",
    "id": "cooke-college-scholarship-program",
    "type": "scholarship",
    "displayType": "Scholarship + Advising",
    "description": "A major national scholarship for high-achieving high school seniors with financial need who plan to attend a four-year college.",
    "stages": [
      "High School Sophomore",
      "High School Junior",
      "High School Senior"
    ],
    "interests": [
      "Education",
      "Career"
    ],
    "states": [],
    "requiredSignals": [],
    "preferredSignals": [
      "EDUCATION",
      "BUSINESS"
    ],
    "excludedSignals": [],
    "sourceUrl": "https://www.jkcf.org/our-scholarships/college-scholarship-program/",
    "sourceLabel": "Official source",
    "opensAt": "2026-08-19",
    "closesAt": "2026-11-11",
    "statusHint": "open",
    "active": true,
    "lastVerifiedAt": "2026-09-04",
    "featured": true,
    "award": "Up to $55,000 per year in last-dollar funding, plus college advising and scholar support.",
    "requirements": [
      "High school senior",
      "High academic achievement",
      "Demonstrated financial need",
      "Four years of high school completed in the U.S. or a U.S. territory"
    ],
    "eligibilityNote": "See official eligibility requirements"
  },
  {
    "num": 7,
    "name": "Thrive Scholars",
    "organization": "Thrive Scholars",
    "statusNote": "December 20, 2026 at 11:59 p.m. PT",
    "id": "thrive-scholars",
    "type": "college access",
    "displayType": "College Access + Career Program",
    "description": "A long-term support program for high-achieving students from under-resourced backgrounds, beginning in high school and continuing through college and into early career.",
    "stages": [
      "High School Sophomore",
      "High School Junior",
      "High School Senior"
    ],
    "interests": [
      "Education",
      "Career"
    ],
    "states": [],
    "requiredSignals": [],
    "preferredSignals": [
      "LOW_INCOME",
      "FIRST_GEN",
      "LIMITED_ACCESS",
      "EDUCATION",
      "BUSINESS"
    ],
    "excludedSignals": [],
    "sourceUrl": "https://thrivescholars.org/scholars/how-to-apply/",
    "sourceLabel": "Official source",
    "opensAt": null,
    "closesAt": "2026-12-20",
    "statusHint": "open",
    "active": true,
    "lastVerifiedAt": "2026-09-04",
    "featured": false,